{
  "$schema": "https://json-schema.org/draft/2020-12/schema",
  "$id": "https://github.com/jhwiv/trip-restaurants/schema.json",
  "title": "Trip Restaurants Dataset",
  "description": "A trip's restaurant data: a pool of restaurants tagged by price tier ($$ Refined / $$$ Elevated / $$$$ Signature), plus a list of dining nights. The user freely picks any pool restaurant for any night — nothing is pre-assigned.",
  "type": "object",
  "required": ["trip", "tiers", "restaurants", "nights"],
  "properties": {
    "trip": {
      "type": "object",
      "required": ["city", "startDate", "endDate"],
      "properties": {
        "city": { "type": "string" },
        "startDate": { "type": "string", "format": "date" },
        "endDate": { "type": "string", "format": "date" },
        "currency": { "type": "string", "default": "USD" },
        "notes": { "type": "string" },
        "party": {
          "type": "object",
          "description": "Default party config used when deep-linking to OpenTable/Resy.",
          "properties": {
            "size": { "type": "integer", "minimum": 1, "default": 1 },
            "defaultTime": { "type": "string", "description": "Default dinner time, e.g. '19:00' or '7:00 PM'." },
            "dietary": { "type": "array", "items": { "type": "string" }, "description": "Free-text dietary notes the traveler may want to reference when calling." }
          }
        }
      }
    },
    "tiers": {
      "type": "object",
      "description": "Tier definitions. Keys are the tier ids; order in the object is the display order (low → high).",
      "properties": {
        "refined":   { "$ref": "#/$defs/tier" },
        "elevated":  { "$ref": "#/$defs/tier" },
        "signature": { "$ref": "#/$defs/tier" }
      },
      "additionalProperties": { "$ref": "#/$defs/tier" }
    },
    "restaurants": {
      "type": "array",
      "description": "Deduped pool of every restaurant in the lineup. Each entry has a tier ('refined'|'elevated'|'signature') and can be picked for any number of nights.",
      "items": { "$ref": "#/$defs/restaurant" },
      "minItems": 1
    },
    "nights": {
      "type": "array",
      "description": "One entry per dining night in the trip, in chronological order. Nights expose the full restaurant pool; user picks per night.",
      "items": { "$ref": "#/$defs/night" }
    },
    "supplementary": {
      "type": "object",
      "description": "Pre-dinner drinks, removed/considered restaurants, and other non-pickable context.",
      "additionalProperties": true
    }
  },

  "$defs": {
    "tier": {
      "type": "object",
      "required": ["label", "priceBand"],
      "properties": {
        "label": { "type": "string", "description": "Human-facing tier label (e.g. 'Refined')." },
        "priceBand": { "type": "string", "description": "Display string (e.g. '$$', '$25–45 pp')." },
        "blurb": { "type": "string", "description": "Short description shown under the tier picker." },
        "leadTime": { "type": "string", "description": "Booking lead time copy (e.g. '4–6 weeks', 'walk-in')." }
      }
    },

    "night": {
      "type": "object",
      "required": ["date", "label"],
      "properties": {
        "date": { "type": "string", "format": "date" },
        "label": { "type": "string", "description": "Human-readable night label (e.g. 'Fri Jun 5 — Canyon Road night')." },
        "theme": { "type": "string", "description": "Optional theme line (e.g. 'arrival', 'Canyon Road night', 'farewell')." },
        "time": { "type": "string", "description": "Default dinner time for this night (e.g. '7:00 PM'). Overrides trip.party.defaultTime when present." }
      }
    },

    "restaurant": {
      "type": "object",
      "required": ["id", "name", "city", "address", "phone", "website", "booking", "verifiedAt", "tier"],
      "properties": {
        "id": { "type": "string", "pattern": "^[a-z0-9-]+$" },
        "tier": { "type": "string", "enum": ["refined", "elevated", "signature"], "description": "Which price band this restaurant belongs to." },
        "name": { "type": "string" },
        "city": { "type": "string" },
        "cuisine": { "type": "string" },
        "address": { "type": "string" },
        "neighborhood": { "type": "string", "description": "e.g. 'Canyon Road', 'Plaza', 'Railyard'." },
        "phone": { "type": "string", "description": "E.164 format preferred (e.g. '+15059821500')." },
        "website": { "type": "string", "format": "uri" },
        "priceBand": { "type": "string", "description": "Display string for this specific restaurant (e.g. '$90–130 pp')." },
        "booking": { "$ref": "#/$defs/booking" },
        "hours": {
          "type": "object",
          "properties": {
            "dinner": { "type": "string", "description": "Human-readable dinner hours line, e.g. 'Mon–Sat 5–9pm'." },
            "openDays": {
              "type": "array",
              "items": { "type": "string", "enum": ["mon","tue","wed","thu","fri","sat","sun"] },
              "description": "Days the restaurant serves dinner. The verifier and UI use this to flag any night whose weekday isn't in this list."
            },
            "closedDays": {
              "type": "array",
              "items": { "type": "string", "enum": ["mon","tue","wed","thu","fri","sat","sun"] },
              "description": "Legacy / alternate to openDays. If both are set, openDays wins."
            }
          }
        },
        "notes": {
          "type": "array",
          "items": { "type": "string" },
          "description": "Short bullets shown in the modal (e.g. 'Patio under the chapel', 'Walk-in rooftop only')."
        },
        "tags": {
          "type": "array",
          "items": { "type": "string" },
          "description": "Free-form tags: 'patio', 'tasting-menu', 'live-music', 'walk-in-friendly', etc."
        },
        "lat": { "type": "number" },
        "lng": { "type": "number" },
        "verifiedAt": { "type": "string", "format": "date", "description": "Last manual or automated QA verification date." },
        "verifiedSources": {
          "type": "array",
          "items": { "type": "string", "format": "uri" }
        },
        "verificationStatus": {
          "type": "string",
          "enum": ["verified", "needs-recheck", "broken", "candidate"],
          "default": "verified",
          "description": "Set by the verify script. 'candidate' = never verified yet; 'broken' = last verify failed."
        }
      }
    },

    "booking": {
      "type": "object",
      "required": ["platform"],
      "properties": {
        "platform": {
          "type": "string",
          "enum": ["opentable", "resy", "tock", "sevenrooms", "yelp", "phone", "walkin"],
          "description": "Which booking system the user should be sent to. 'phone' = call only. 'walkin' = no reservations at all."
        },
        "url": { "type": "string", "format": "uri", "description": "Direct reservation URL when platform is online. Omitted for phone/walkin." },
        "leadTime": { "type": "string", "description": "Override of the tier-level lead time (e.g. '6+ weeks', 'same day')." },
        "note": { "type": "string", "description": "Inline note shown next to the reserve button (e.g. 'Limited online June availability — call')." },
        "rooftopWalkInOnly": { "type": "boolean", "description": "Special-case flag for places like Coyote Cafe where the rooftop is walk-in but the main floor is bookable." }
      }
    }
  }
}
