{
  "$schema": "../schema.json",
  "trip": {
    "city": "Santa Fe",
    "startDate": "2026-06-03",
    "endDate": "2026-06-10",
    "currency": "USD",
    "notes": "Pool-based lineup updated 2026-05-27. Each night has a curated primary recommendation + backup; both are bookable cards. You can swap either at any time by browsing the full pool below — nothing is locked in.",
    "party": {
      "size": 1,
      "defaultTime": "19:00",
      "dietary": []
    }
  },
  "tiers": {
    "refined": {
      "label": "Refined",
      "priceBand": "$$",
      "blurb": "Local, lived-in, food-first.",
      "leadTime": "1–2 days or walk-in"
    },
    "elevated": {
      "label": "Elevated",
      "priceBand": "$$$",
      "blurb": "Polished, real night out.",
      "leadTime": "1–2 weeks"
    },
    "signature": {
      "label": "Signature",
      "priceBand": "$$$$",
      "blurb": "Special-occasion, Canyon Road energy.",
      "leadTime": "3–4 weeks"
    }
  },
  "restaurants": [
    {
      "id": "the-shed-santa-fe",
      "name": "The Shed",
      "city": "Santa Fe",
      "cuisine": "New Mexican",
      "neighborhood": "Plaza",
      "address": "113½ E Palace Ave, Santa Fe, NM 87501",
      "phone": "+15059829030",
      "website": "https://sfshed.com",
      "priceBand": "$25–40 pp",
      "booking": {
        "platform": "phone",
        "note": "Dinner is phone reservations or walk-in; call (505) 982-9030. Closed Sundays."
      },
      "notes": [
        "70-year Santa Fe institution since 1953",
        "Red chile enchiladas are the order",
        "End the trip on the food you came for: red chile enchiladas",
        "Tuesday is the calmest service night"
      ],
      "tags": [
        "walk-in-friendly",
        "iconic",
        "casual",
        "farewell"
      ],
      "verifiedAt": "2026-05-27",
      "verificationStatus": "verified",
      "hours": {
        "dinner": "Mon–Sat 5–9pm",
        "openDays": [
          "mon",
          "tue",
          "wed",
          "thu",
          "fri",
          "sat"
        ]
      },
      "tier": "refined"
    },
    {
      "id": "anasazi-restaurant",
      "name": "Anasazi Restaurant",
      "city": "Santa Fe",
      "cuisine": "Contemporary American / Southwest",
      "neighborhood": "Plaza",
      "address": "113 Washington Ave, Santa Fe, NM 87501",
      "phone": "+15059883030",
      "website": "https://www.rosewoodhotels.com/en/inn-of-the-anasazi-santa-fe/dining/anasazi-restaurant",
      "priceBand": "$65–95 pp",
      "booking": {
        "platform": "opentable",
        "url": "https://www.opentable.com/r/anasazi-restaurant",
        "leadTime": "1–2 weeks"
      },
      "notes": [
        "Rosewood Inn of the Anasazi hotel restaurant",
        "Open daily 5–9:30pm — useful arrival-night fallback close to Plaza",
        "Peer review note: setting and convenience are the credentials, not the cooking"
      ],
      "tags": [
        "hotel-restaurant",
        "plaza-walkable",
        "open-daily"
      ],
      "verifiedAt": "2026-05-27",
      "verificationStatus": "verified",
      "hours": {
        "dinner": "Daily 5–9:30pm",
        "openDays": [
          "mon",
          "tue",
          "wed",
          "thu",
          "fri",
          "sat",
          "sun"
        ]
      },
      "tier": "elevated"
    },
    {
      "id": "sazon-santa-fe",
      "name": "Sazón",
      "city": "Santa Fe",
      "cuisine": "Contemporary Mexican",
      "neighborhood": "Plaza",
      "address": "221 Shelby St, Santa Fe, NM 87501",
      "phone": "+15059838604",
      "website": "https://sazonsantafe.com",
      "priceBand": "$95–145 pp",
      "booking": {
        "platform": "opentable",
        "url": "https://www.opentable.com/sazon-santa-fe",
        "leadTime": "2–3 weeks",
        "note": "Chef's Degustación is phone-only"
      },
      "notes": [
        "Chef Fernando Olea — 2022 James Beard Best Chef Southwest",
        "#1 restaurant in Santa Fe on Tripadvisor",
        "Mon–Sat, last seating 8pm",
        "Business-casual dress code; no children under 10"
      ],
      "tags": [
        "james-beard-winner",
        "tasting-menu",
        "intimate"
      ],
      "verifiedAt": "2026-05-27",
      "verificationStatus": "verified",
      "hours": {
        "dinner": "Mon–Sat 5–8pm (last seating 8pm)",
        "openDays": [
          "mon",
          "tue",
          "wed",
          "thu",
          "fri",
          "sat"
        ]
      },
      "tier": "signature"
    },
    {
      "id": "la-boca-santa-fe",
      "name": "La Boca",
      "city": "Santa Fe",
      "cuisine": "Spanish tapas",
      "neighborhood": "Downtown",
      "address": "72 W Marcy St, Santa Fe, NM 87501",
      "phone": "+15059823433",
      "website": "http://www.labocasantafe.com",
      "priceBand": "$40–65 pp",
      "booking": {
        "platform": "opentable",
        "url": "https://www.opentable.com/r/la-boca-santa-fe",
        "leadTime": "1 week"
      },
      "notes": [
        "Chef James Campbell Caruso — 8× James Beard Best Chef SW nominee (2008–2014)",
        "Canyon Road's best Spanish offering now that El Farol is closed",
        "Sister bar Taberna next door for cocktails"
      ],
      "tags": [
        "tapas",
        "wine-program",
        "chef-driven"
      ],
      "verifiedAt": "2026-05-27",
      "verificationStatus": "verified",
      "hours": {
        "dinner": "Wed–Sun, dinner from 5pm",
        "openDays": [
          "wed",
          "thu",
          "fri",
          "sat",
          "sun"
        ]
      },
      "tier": "refined"
    },
    {
      "id": "wolf-and-roadrunner",
      "name": "Wolf and Roadrunner",
      "city": "Santa Fe",
      "cuisine": "Contemporary Southwest / wood-fire",
      "neighborhood": "Plaza (Hotel St. Francis)",
      "address": "210 Don Gaspar Ave, Santa Fe, NM 87501",
      "phone": "+15059926342",
      "website": "https://www.hotelstfrancis.com/eat-drink/wolf-and-roadrunner",
      "priceBand": "$55–85 pp",
      "booking": {
        "platform": "resy",
        "url": "https://resy.com/cities/santa-fe-nm/venues/wolf-and-roadrunner",
        "leadTime": "1–2 weeks",
        "note": "Rebranded from Tabla de los Santos. Thu–Sun only."
      },
      "notes": [
        "Replaces Tabla de los Santos (rebrand, 2025)",
        "Wood-fire / seasonal concept",
        "Thu–Fri 3–8pm, Sat–Sun 1–8pm"
      ],
      "tags": [
        "new-concept",
        "hotel-restaurant",
        "limited-days"
      ],
      "verifiedAt": "2026-05-27",
      "verificationStatus": "verified",
      "hours": {
        "dinner": "Thu–Fri 3–8pm, Sat–Sun 1–8pm",
        "openDays": [
          "thu",
          "fri",
          "sat",
          "sun"
        ]
      },
      "tier": "elevated"
    },
    {
      "id": "the-compound-restaurant",
      "name": "The Compound",
      "city": "Santa Fe",
      "cuisine": "Contemporary American",
      "neighborhood": "Canyon Road",
      "address": "653 Canyon Rd, Santa Fe, NM 87501",
      "phone": "+15059824353",
      "website": "https://compoundrestaurant.com",
      "priceBand": "$150–250 pp",
      "booking": {
        "platform": "resy",
        "url": "https://resy.com/cities/santa-fe-nm/venues/the-compound-restaurant",
        "leadTime": "3–4 weeks",
        "note": "Phone reservations preferred: (505) 982-4353. Not on OpenTable."
      },
      "notes": [
        "**Blowout meal of the trip.** 2024 James Beard Outstanding Restaurant finalist — one of five in the country",
        "Chef-owner Mark Kiffin — 2005 JB Best Chef Southwest winner",
        "500+ wine selections",
        "Closed Sundays",
        "Historic adobe compound on Canyon Road",
        "The peer review's confirmed best farewell meal",
        "2024 James Beard Outstanding Restaurant finalist",
        "If already used Thu Jun 4 — Sazón is the alternate farewell"
      ],
      "tags": [
        "james-beard-finalist",
        "wine-program",
        "blowout",
        "canyon-road",
        "farewell"
      ],
      "verifiedAt": "2026-05-27",
      "verificationStatus": "verified",
      "hours": {
        "dinner": "Mon–Sat 5–8:30pm, Sun 5–7:30pm",
        "openDays": [
          "mon",
          "tue",
          "wed",
          "thu",
          "fri",
          "sat",
          "sun"
        ]
      },
      "tier": "signature"
    },
    {
      "id": "zacatlan-santa-fe",
      "name": "Zacatlán",
      "city": "Santa Fe",
      "cuisine": "Contemporary Mexican",
      "neighborhood": "Railyard",
      "address": "317 Aztec St, Santa Fe, NM 87501",
      "phone": "+15057805174",
      "website": "https://www.zacatlanrestaurant.com",
      "priceBand": "$45–75 pp",
      "booking": {
        "platform": "opentable",
        "url": "https://www.opentable.com/r/zacatlan-santa-fe",
        "leadTime": "1 week"
      },
      "notes": [
        "Chef Eduardo Rodriguez (former Coyote Cafe exec sous) — 2024 James Beard Best Chef SW nominee",
        "Mole-driven, whole red snapper, Cochinita Pibil",
        "Distinct from Sazón — Railyard setting, à la carte focus"
      ],
      "tags": [
        "james-beard-nominee",
        "railyard",
        "contemporary-mexican"
      ],
      "verifiedAt": "2026-05-27",
      "verificationStatus": "verified",
      "hours": {
        "dinner": "Daily 5–9pm",
        "openDays": [
          "mon",
          "tue",
          "wed",
          "thu",
          "fri",
          "sat",
          "sun"
        ]
      },
      "tier": "refined"
    },
    {
      "id": "josephs-culinary-pub",
      "name": "Joseph's Culinary Pub",
      "city": "Santa Fe",
      "cuisine": "Eclectic American",
      "neighborhood": "Guadalupe / Railyard",
      "address": "428 Agua Fria St, Santa Fe, NM 87501",
      "phone": "+15059821272",
      "website": "https://www.josephsculinarypub.com",
      "priceBand": "$55–85 pp",
      "booking": {